title,tag,artist,year,views,lyrics,language,processed_lyrics,processed_LDA_lyrics,topic,theme
White Iverson,rap,post malone,2015,4193863,"[Intro]
Double OT
I'm a new three

[Chorus]
Saucin', saucin', I'm saucin' on you
I'm swaggin', I'm swaggin', I'm swaggin', oh-ooh (Swaggin')
I'm ballin', I'm ballin', Iverson on you (Swish, ooh, ayy)
Watch out, watch out, watch out, yeah
That's my shot, that's my shot, that's my shot, yeah
Spendin', I'm spendin' all my fuckin' pay

[Verse 1]
I got me some braids and I got me some hoes
Started rockin' the sleeve, I can't ball with no Joes
You know how I do it, Concords on my toes
(This shit is hard) Oh
I ain't rich yet, but you know I ain't broke, ah
So if I see it, I like it, buy that from the store, ah (Store, ah)
I'm with some white girls and they lovin' the coca (Coca)
Like they OT
Double OT like I'm KD, smokin' OG (Smokin' OG)
And you know me, in my 2-3s and my gold teeth (And my gold teeth)
Bitch, I'm smiling, bet you see me from the nosebleeds (Nosebleeds)
I'm the new three and I change out to my new 3s (To my new 3s)
[Pre-Chorus]
White Iverson
When I started ballin', I was young
You gon' think about me when I'm gone
I need that money like the ring I never won, I won

[Chorus]
Saucin', saucin', I'm saucin' on you
I'm swaggin', I'm swaggin', I'm swaggin', oh-ooh
I'm ballin', I'm ballin', Iverson on you
Watch out, watch out, watch out, yeah
That's my shot, that's my shot, that's my shot, yeah
Spendin', I'm spendin' all my fuckin' pay

[Verse 2]
Ooh, Stoney
Cigarettes and a headband
Commas, commas in my head, man
Slumped over like a dead man
Red and black, 'bout my bread, man
I'm the answer, never question
Lace up, learn a lesson
Bitch, I'm saucin' (Wow), I do this often, don't do no talkin' (No)
My options right when I walk in, jump all them Jordans (Ooh)
I'm ballin', money jumpin'
Like I'm Davis from New Orleans
Or bitch, I'm Harden, I don't miss nothin'
Fuck practice, this shit just happens, know y'all can't stand it (Ayy)
I have it, I never pass it, I work my magic
High average, ball on these bastards, it makes me happy
It's tragic, I make it happen, and all y'all Shaqtin'
[Pre-Chorus]
White Iverson
When I started ballin' I was young
You gon' think about me when I'm gone
I need that money like the ring I never won, I won

[Chorus]
Saucin', saucin', I'm saucin' on you
I'm swaggin', I'm swaggin', I'm swaggin', oh-ooh
I'm ballin', I'm ballin', Iverson on you
Watch out, watch out, watch out, yeah
That's my shot, that's my shot, that's my shot, yeah
Spendin', I'm spendin' all my fuckin' pay

[Outro]
Ooh-ooh
Ooh-ooh
Ooh-ooh
Ooh-ooh",en,"double ot i'm a new three  saucin' , saucin' , i'm saucin' on you i'm swaggin' , i'm swaggin' , i'm swaggin' , oh-ooh  i'm ballin' , i'm ballin' , iverson on you  watch out , watch out , watch out , yeah that's my shot , that's my shot , that's my shot , yeah spendin' , i'm spendin' all my fuckin' pay  i got me some braids and i got me some hoes started rockin' the sleeve , i can't ball with no joes you know how i do it , concords on my toes  oh i ain't rich yet , but you know i ain't broke , ah so if i see it , i like it , buy that from the store , ah  i'm with some white girls and they lovin' the coca  like they ot double ot like i'm kd , smokin' og  and you know me , in my 2-3s and my gold teeth  bitch , i'm smiling , bet you see me from the nosebleeds  i'm the new three and i change out to my new 3s   white iverson when i started ballin' , i was young you gon' think about me when i'm gone i need that money like the ring i never won , i won  saucin' , saucin' , i'm saucin' on you i'm swaggin' , i'm swaggin' , i'm swaggin' , oh-ooh i'm ballin' , i'm ballin' , iverson on you watch out , watch out , watch out , yeah that's my shot , that's my shot , that's my shot , yeah spendin' , i'm spendin' all my fuckin' pay  ooh , stoney cigarettes and a headband commas , commas in my head , man slumped over like a dead man red and black , 'bout my bread , man i'm the answer , never question lace up , learn a lesson bitch , i'm saucin'  , i do this often , don't do no talkin'  my options right when i walk in , jump all them jordans  i'm ballin' , money jumpin' like i'm davis from new orleans or bitch , i'm harden , i don't miss nothin' fuck practice , this shit just happens , know y'all can't stand it  i have it , i never pass it , i work my magic high average , ball on these bastards , it makes me happy it's tragic , i make it happen , and all y'all shaqtin'  white iverson when i started ballin' i was young you gon' think about me when i'm gone i need that money like the ring i never won , i won  saucin' , saucin' , i'm saucin' on you i'm swaggin' , i'm swaggin' , i'm swaggin' , oh-ooh i'm ballin' , i'm ballin' , iverson on you watch out , watch out , watch out , yeah that's my shot , that's my shot , that's my shot , yeah spendin' , i'm spendin' all my fuckin' pay  ooh-ooh ooh-ooh ooh-ooh ooh-ooh","['double', 'ot', 'new', 'saucin', 'saucin', 'saucin', 'swaggin', 'swaggin', 'swaggin', 'oh', 'ooh', 'ballin', 'ballin', 'iverson', 'watch', 'watch', 'watch', 'yeah', 'shot', 'shot', 'shot', 'yeah', 'spendin', 'spendin', 'fuckin', 'pay', 'got', 'braids', 'got', 'hoes', 'started', 'rockin', 'sleeve', 'ball', 'joes', 'know', 'concords', 'toes', 'oh', 'ai', 'rich', 'know', 'ai', 'broke', 'ah', 'like', 'buy', 'store', 'ah', 'white', 'girls', 'coca', 'like', 'ot', 'double', 'ot', 'like', 'kd', 'smokin', 'og', 'know', 'gold', 'teeth', 'bitch', 'smiling', 'bet', 'nosebleeds', 'new', 'change', 'new', 'white', 'iverson', 'started', 'ballin', 'young', 'gon', 'think', 'gone', 'need', 'money', 'like', 'ring', 'won', 'won', 'saucin', 'saucin', 'saucin', 'swaggin', 'swaggin', 'swaggin', 'oh', 'ooh', 'ballin', 'ballin', 'iverson', 'watch', 'watch', 'watch', 'yeah', 'shot', 'shot', 'shot', 'yeah', 'spendin', 'spendin', 'fuckin', 'pay', 'ooh', 'stoney', 'cigarettes', 'headband', 'commas', 'commas', 'head', 'man', 'slumped', 'like', 'dead', 'man', 'red', 'black', 'bread', 'man', 'answer', 'question', 'lace', 'learn', 'lesson', 'bitch', 'saucin', 'talkin', 'options', 'right', 'walk', 'jump', 'jordans', 'ballin', 'money', 'jumpin', 'like', 'davis', 'new', 'orleans', 'bitch', 'harden', 'miss', 'fuck', 'practice', 'shit', 'happens', 'know', 'stand', 'pass', 'work', 'magic', 'high', 'average', 'ball', 'bastards', 'makes', 'happy', 'tragic', 'happen', 'shaqtin', 'white', 'iverson', 'started', 'ballin', 'young', 'gon', 'think', 'gone', 'need', 'money', 'like', 'ring', 'won', 'won', 'saucin', 'saucin', 'saucin', 'swaggin', 'swaggin', 'swaggin', 'oh', 'ooh', 'ballin', 'ballin', 'iverson', 'watch', 'watch', 'watch', 'yeah', 'shot', 'shot', 'shot', 'yeah', 'spendin', 'spendin', 'fuckin', 'pay', 'ooh', 'ooh', 'ooh', 'ooh', 'ooh', 'ooh', 'ooh', 'ooh']",7,Self-Reflection
Thats It,rap,post malone,2015,56297,"[Intro - Sample]

[Verse 1]
Woke up in a hot tub, spillin' Moet, in the water
Then I light my marijuana, take a shot up out the choppa
J's jumpin' out the locker, spend a little guapa
She want candy, Aaron Carter
I called her Candy when I saw her
Pull up with my brothers
Candy-painted flyin' saucer
Test me, you'll get flyin' colors

[Pre-Chorus]
Hunnid bitches comin' up the steps
Turn the front lights on, when I know they on they way
She said she don't wanna do too much drugs
Believe me, baby, I do this shit like every day, like every day

[Chorus]
She don't want a thing, I don't want a thing
She come over, pop a couple beans
And that's it, and that's it, ayy
She don't want a thing, I don't want a thing
She come over, pop a couple beans
And that's it, and that's it
(Stoney, Stoney, uh, yeah)
[Verse 2]
Wanna talk about them Martins?
Do you wanna talk about them Jordans?
Enjoy a 40 every mornin', Everclear and some recordin'
101, on the 101 like Jeff Gordon
I just popped a pill, she just popped a pill
And we might just pop some more, I ain't stoppin' 'til like 20
Up until like 4, SmartWater like some dummies
Takin' shots up out the semi, that shit kill me like I'm Kenny

[Pre-Chorus]
Uh, bitches walkin' down the steps
Turn the front lights off, got a blunt all to myself
No, I don't want all this shit to get too deep
But listen, baby, there ain't no shit with you and me
No ""you and me,"" no

[Chorus]
She don't want a thing, I don't want a thing
She come over, pop a couple beans
And that's it, and that's it, ayy
She don't want a thing, I don't want a thing
She come over, pop a couple beans
And that's it, and that's it
And that's it
[Outro - Sample]",en,"woke up in a hot tub , spillin' moet , in the water then i light my marijuana , take a shot up out the choppa j's jumpin' out the locker , spend a little guapa she want candy , aaron carter i called her candy when i saw her pull up with my brothers candy-painted flyin' saucer test me , you'll get flyin' colors  hunnid bitches comin' up the steps turn the front lights on , when i know they on they way she said she don't wanna do too much drugs believe me , baby , i do this shit like every day , like every day  she don't want a thing , i don't want a thing she come over , pop a couple beans and that's it , and that's it , ayy she don't want a thing , i don't want a thing she come over , pop a couple beans and that's it , and that's it   wanna talk about them martins ? do you wanna talk about them jordans ? enjoy a 40 every mornin' , everclear and some recordin' 101 , on the 101 like jeff gordon i just popped a pill , she just popped a pill and we might just pop some more , i ain't stoppin' 'til like 20 up until like 4 , smartwater like some dummies takin' shots up out the semi , that shit kill me like i'm kenny  uh , bitches walkin' down the steps turn the front lights off , got a blunt all to myself no , i don't want all this shit to get too deep but listen , baby , there ain't no shit with you and me no ""you and me , "" no  she don't want a thing , i don't want a thing she come over , pop a couple beans and that's it , and that's it , ayy she don't want a thing , i don't want a thing she come over , pop a couple beans and that's it , and that's it and that's it","['woke', 'hot', 'tub', 'spillin', 'moet', 'water', 'light', 'marijuana', 'shot', 'choppa', 'j', 'jumpin', 'locker', 'spend', 'little', 'guapa', 'want', 'candy', 'aaron', 'carter', 'called', 'candy', 'saw', 'pull', 'brothers', 'candy', 'painted', 'flyin', 'saucer', 'test', 'flyin', 'colors', 'hunnid', 'bitches', 'comin', 'steps', 'turn', 'lights', 'know', 'way', 'said', 'wanna', 'drugs', 'believe', 'baby', 'shit', 'like', 'day', 'like', 'day', 'want', 'thing', 'want', 'thing', 'come', 'pop', 'couple', 'beans', 'ayy', 'want', 'thing', 'want', 'thing', 'come', 'pop', 'couple', 'beans', 'wanna', 'talk', 'martins', 'wanna', 'talk', 'jordans', 'enjoy', 'mornin', 'everclear', 'recordin', 'like', 'jeff', 'gordon', 'popped', 'pill', 'popped', 'pill', 'pop', 'ai', 'stoppin', 'til', 'like', 'like', 'smartwater', 'like', 'dummies', 'takin', 'shots', 'semi', 'shit', 'kill', 'like', 'kenny', 'uh', 'bitches', 'walkin', 'steps', 'turn', 'lights', 'got', 'blunt', 'want', 'shit', 'deep', 'listen', 'baby', 'ai', 'shit', 'want', 'thing', 'want', 'thing', 'come', 'pop', 'couple', 'beans', 'ayy', 'want', 'thing', 'want', 'thing', 'come', 'pop', 'couple', 'beans']",5,Fame & Lifestyle
TEAR$,rap,post malone,2015,114164,"[Chorus: Post Malone]
I wipe my tears with the money, yeah
I wipe my tears with the money, yeah
That Supreme takes the pain away
I wipe my tears with the money, yeah
I wipe my tears with the money, yeah
I wipe my tears with the money, yeah
That Supreme takes the pain away
I wipe my tears with the money, yeah

[Verse 1: Post Malone]
What you know about me?
Y'all don't really know shit and I'm fuckin' your bitch right now (your bitch, fuckin' your bitch)
And I really really hit the Palisades right now
Supreme on my back and I'm whippin' the woo (skrr, skrr, skrr)
Man, these bitches don't know, man these bitches don't know
I'm swaggin' on these hoes and I pull up in that ""whoa""
And I pull up on that road, doin' hundred miles and hold
Man, I poke another hole, I smoke another O
And I pour another O and I smoke another, smoke another
Pull up on Fairfax, drop top (in the drop top)
Hop out into the 'preme store, top notch
Already bread jumpin' out the pockets
Ain't no worries, wipe my tears with my dollars, ayy
[Chorus: Post Malone]
I wipe my tears with the money, yeah
I wipe my tears with the money, yeah
That Supreme takes the pain away
I wipe my tears with the money, yeah
I wipe my tears with the money, yeah
I wipe my tears with the money, yeah
That Supreme takes the pain away
I wipe my tears with the money, yeah

[Verse 2: 1st]
Ayy, if I got an issue, I don't need no tissue (achoo, bless you)
My bitch started cryin', I bought her a Shih Tzu (woof)
You gotta do what you gotta do just to get through (just to get through)
And if you play with my money, your mom gon' miss you (R.I.P.)
I started throwin' a tantrum, so I copped me a Phantom
And every time she gets mad, I throw the keys to the Jag
Broke niggas call me materialistic (materialistic)
We do not ball the same, you're still learnin' how to pivot (still learnin' to pivot)
Ayy, since I got rich, I don't drink beer (nah)
Leave the mall, leave a trail of tears
I told my son don't have no fears
If he ever feels down, we can take off in the Lear
We could be gone tomorrow, love today (love today)
And when that check hit my account, this what I say (this what I say)
[Chorus: Post Malone]
I wipe my tears with the money, yeah
I wipe my tears with the money, yeah
That Supreme takes the pain away
I wipe my tears with the money, yeah
I wipe my tears with the money, yeah
I wipe my tears with the money, yeah
That Supreme takes the pain away
I wipe my tears with the money, yeah",en,"i wipe my tears with the money , yeah i wipe my tears with the money , yeah that supreme takes the pain away i wipe my tears with the money , yeah i wipe my tears with the money , yeah i wipe my tears with the money , yeah that supreme takes the pain away i wipe my tears with the money , yeah  what you know about me ? y'all don't really know shit and i'm fuckin' your bitch right now  and i really really hit the palisades right now supreme on my back and i'm whippin' the woo  man , these bitches don't know , man these bitches don't know i'm swaggin' on these hoes and i pull up in that ""whoa"" and i pull up on that road , doin' hundred miles and hold man , i poke another hole , i smoke another o and i pour another o and i smoke another , smoke another pull up on fairfax , drop top  hop out into the 'preme store , top notch already bread jumpin' out the pockets ain't no worries , wipe my tears with my dollars , ayy  i wipe my tears with the money , yeah i wipe my tears with the money , yeah that supreme takes the pain away i wipe my tears with the money , yeah i wipe my tears with the money , yeah i wipe my tears with the money , yeah that supreme takes the pain away i wipe my tears with the money , yeah  ayy , if i got an issue , i don't need no tissue  my bitch started cryin' , i bought her a shih tzu  you gotta do what you gotta do just to get through  and if you play with my money , your mom gon' miss you  i started throwin' a tantrum , so i copped me a phantom and every time she gets mad , i throw the keys to the jag broke niggas call me materialistic  we do not ball the same , you're still learnin' how to pivot  ayy , since i got rich , i don't drink beer  leave the mall , leave a trail of tears i told my son don't have no fears if he ever feels down , we can take off in the lear we could be gone tomorrow , love today  and when that check hit my account , this what i say   i wipe my tears with the money , yeah i wipe my tears with the money , yeah that supreme takes the pain away i wipe my tears with the money , yeah i wipe my tears with the money , yeah i wipe my tears with the money , yeah that supreme takes the pain away i wipe my tears with the money , yeah","['wipe', 'tears', 'money', 'yeah', 'wipe', 'tears', 'money', 'yeah', 'supreme', 'takes', 'pain', 'away', 'wipe', 'tears', 'money', 'yeah', 'wipe', 'tears', 'money', 'yeah', 'wipe', 'tears', 'money', 'yeah', 'supreme', 'takes', 'pain', 'away', 'wipe', 'tears', 'money', 'yeah', 'know', 'know', 'shit', 'fuckin', 'bitch', 'right', 'hit', 'palisades', 'right', 'supreme', 'whippin', 'woo', 'man', 'bitches', 'know', 'man', 'bitches', 'know', 'swaggin', 'hoes', 'pull', 'whoa', 'pull', 'road', 'miles', 'hold', 'man', 'poke', 'hole', 'smoke', 'o', 'pour', 'o', 'smoke', 'smoke', 'pull', 'fairfax', 'drop', 'hop', 'preme', 'store', 'notch', 'bread', 'jumpin', 'pockets', 'ai', 'worries', 'wipe', 'tears', 'dollars', 'ayy', 'wipe', 'tears', 'money', 'yeah', 'wipe', 'tears', 'money', 'yeah', 'supreme', 'takes', 'pain', 'away', 'wipe', 'tears', 'money', 'yeah', 'wipe', 'tears', 'money', 'yeah', 'wipe', 'tears', 'money', 'yeah', 'supreme', 'takes', 'pain', 'away', 'wipe', 'tears', 'money', 'yeah', 'ayy', 'got', 'issue', 'need', 'tissue', 'bitch', 'started', 'cryin', 'bought', 'shih', 'tzu', 'got', 'ta', 'got', 'ta', 'play', 'money', 'mom', 'gon', 'miss', 'started', 'throwin', 'tantrum', 'copped', 'phantom', 'time', 'gets', 'mad', 'throw', 'keys', 'jag', 'broke', 'niggas', 'materialistic', 'ball', 'learnin', 'pivot', 'ayy', 'got', 'rich', 'drink', 'beer', 'leave', 'mall', 'leave', 'trail', 'tears', 'told', 'son', 'fears', 'feels', 'lear', 'gone', 'tomorrow', 'love', 'today', 'check', 'hit', 'account', 'wipe', 'tears', 'money', 'yeah', 'wipe', 'tears', 'money', 'yeah', 'supreme', 'takes', 'pain', 'away', 'wipe', 'tears', 'money', 'yeah', 'wipe', 'tears', 'money', 'yeah', 'wipe', 'tears', 'money', 'yeah', 'supreme', 'takes', 'pain', 'away', 'wipe', 'tears', 'money', 'yeah']",8,Self-Reflection
Too Young,rap,post malone,2015,718101,"[Intro]
I don't wanna die too young (Uh)
Yuh, too young (Uh, uh-uh)
Yuh, too young

[Chorus]
I don't wanna die too young (Too young)
Too young (Too young)
Too young (Too young, uh)
Countin' bands, hallelujah ('Lujah)
'Lujah ('Lujah)
'Lujah, yuh ('Lujah, uh)
I don't wanna die too young (Too young)
Too young (Too young)
Too young, uh (Too young, uh-uh)
I've been grindin' way too long (Too long)
Too long (Too long)
Too long, uh (Yeah, ayy)

[Verse 1]
Came up, don't know (I don't)
I just keep goin' with the flow (Flow)
I just wanna go and cop me somethin'
I hit Fairfax, go shoppin' though (Ayy)
She just wanna hit that bathingroom (Oh)
Hold that guap like a register
Keep on winnin', need that guapa though
Like I'm cash out, eat at Pappadeaux
Flowin' on to the Galapagos, runnin' and grab the dough
Man, this shit never minimal, feel like an animal
Yeah, bitch, I tryna keep me cool (Tryna, tryna)
'Cause I ain't never goin', never goin' back, uh (Tryna never)
Yeah, I don't wanna die too young (Too young)
I don't wanna die too young (Too young)
When I get that cash, it's hallelujah, ayy, hallelujah
Ayy, hallelujah, ayy (Ayy, ayy)
Hallelujah, ayy (Ayy, ayy, hallelujah)
[Chorus]
I don't wanna die too young (No, ain't no)
Too young (Too young)
Too young (Too young)
Countin' bands, hallelujah ('Lujah, 'lujah)
'Lujah ('Lujah, 'lujah)
'Lujah, yuh
I don't wanna die too young (Too young)
Too young (Yeah)
Too young, uh
I've been grindin' way too long
Too long (Way too long)
Too long, uh

[Verse 2]
Ayy, whip fast, my bitch bad, I skrrt, skrrt, that coupe fast
My coupe fast, yo' bitch know (Yo' bitch know, skrrt, skrrt)
My bitch slow, she do what I say so
And she always keep me on my toes (My toes)
Poppin' that woe, man, I be gone, ayy (Whoa)
Just watch me go, bitches, they watchin' me go (Whoa)
Walkin' around, ayy, I pick that band up
And then I go drop that shit off, ayy (Oh)
Pull up in a Porsche, shit poppin' off
Pop that shit off, I got that bitch off
I tell her to knock that shit off and I got my nut off
And she washed my nuts off, ayy
Yeah, I want that shit (Okay)
I got that shit, pop that shit, got rich quick, suck my— (Ooh)
You know it make me goddamn numb (Ayy, yeah)
When I see 'em die so goddamn young
[Chorus]
I don't wanna die too young (I'm too young)
Too young (Too young)
Too young (Too young)
Countin' bands, hallelujah (Too young, goddamn)
'Lujah (Goddamn)
'Lujah, yuh (Yeah)
I don't wanna die too young (No way)
Too young (Too young)
Too young, uh (Too young)
I've been grindin' way too long (Too long)
Too long (Too long)
Too long, uh (Too long)

[Outro]
I don't wanna die too young, too young, too young
Countin' bands, hallelujah, 'lujah, 'lujah, yuh
I don't wanna die too young, too young, too young, uh",en,"i don't wanna die too young  yuh , too young  yuh , too young  i don't wanna die too young  too young  too young  countin' bands , hallelujah  'lujah  'lujah , yuh  i don't wanna die too young  too young  too young , uh  i've been grindin' way too long  too long  too long , uh   came up , don't know  i just keep goin' with the flow  i just wanna go and cop me somethin' i hit fairfax , go shoppin' though  she just wanna hit that bathingroom  hold that guap like a register keep on winnin' , need that guapa though like i'm cash out , eat at pappadeaux flowin' on to the galapagos , runnin' and grab the dough man , this shit never minimal , feel like an animal yeah , bitch , i tryna keep me cool  'cause i ain't never goin' , never goin' back , uh  yeah , i don't wanna die too young  i don't wanna die too young  when i get that cash , it's hallelujah , ayy , hallelujah ayy , hallelujah , ayy  hallelujah , ayy   i don't wanna die too young  too young  too young  countin' bands , hallelujah  'lujah  'lujah , yuh i don't wanna die too young  too young  too young , uh i've been grindin' way too long too long  too long , uh  ayy , whip fast , my bitch bad , i skrrt , skrrt , that coupe fast my coupe fast , yo' bitch know  my bitch slow , she do what i say so and she always keep me on my toes  poppin' that woe , man , i be gone , ayy  just watch me go , bitches , they watchin' me go  walkin' around , ayy , i pick that band up and then i go drop that shit off , ayy  pull up in a porsche , shit poppin' off pop that shit off , i got that bitch off i tell her to knock that shit off and i got my nut off and she washed my nuts off , ayy yeah , i want that shit  i got that shit , pop that shit , got rich quick , suck my—  you know it make me goddamn numb  when i see 'em die so goddamn young  i don't wanna die too young  too young  too young  countin' bands , hallelujah  'lujah  'lujah , yuh  i don't wanna die too young  too young  too young , uh  i've been grindin' way too long  too long  too long , uh   i don't wanna die too young , too young , too young countin' bands , hallelujah , 'lujah , 'lujah , yuh i don't wanna die too young , too young , too young , uh","['wanna', 'die', 'young', 'yuh', 'young', 'yuh', 'young', 'wanna', 'die', 'young', 'young', 'young', 'countin', 'bands', 'hallelujah', 'lujah', 'lujah', 'yuh', 'wanna', 'die', 'young', 'young', 'young', 'uh', 'grindin', 'way', 'long', 'long', 'long', 'uh', 'came', 'know', 'flow', 'wanna', 'cop', 'hit', 'fairfax', 'shoppin', 'wanna', 'hit', 'bathingroom', 'hold', 'guap', 'like', 'register', 'winnin', 'need', 'guapa', 'like', 'cash', 'eat', 'pappadeaux', 'flowin', 'galapagos', 'runnin', 'grab', 'dough', 'man', 'shit', 'minimal', 'feel', 'like', 'animal', 'yeah', 'bitch', 'tryna', 'cool', 'ai', 'uh', 'yeah', 'wanna', 'die', 'young', 'wanna', 'die', 'young', 'cash', 'hallelujah', 'ayy', 'hallelujah', 'ayy', 'hallelujah', 'ayy', 'hallelujah', 'ayy', 'wanna', 'die', 'young', 'young', 'young', 'countin', 'bands', 'hallelujah', 'lujah', 'lujah', 'yuh', 'wanna', 'die', 'young', 'young', 'young', 'uh', 'grindin', 'way', 'long', 'long', 'long', 'uh', 'ayy', 'whip', 'fast', 'bitch', 'bad', 'skrrt', 'skrrt', 'coupe', 'fast', 'coupe', 'fast', 'yo', 'bitch', 'know', 'bitch', 'slow', 'toes', 'poppin', 'woe', 'man', 'gone', 'ayy', 'watch', 'bitches', 'watchin', 'walkin', 'ayy', 'pick', 'band', 'drop', 'shit', 'ayy', 'pull', 'porsche', 'shit', 'poppin', 'pop', 'shit', 'got', 'bitch', 'tell', 'knock', 'shit', 'got', 'nut', 'washed', 'nuts', 'ayy', 'yeah', 'want', 'shit', 'got', 'shit', 'pop', 'shit', 'got', 'rich', 'quick', 'suck', 'know', 'goddamn', 'numb', 'die', 'goddamn', 'young', 'wanna', 'die', 'young', 'young', 'young', 'countin', 'bands', 'hallelujah', 'lujah', 'lujah', 'yuh', 'wanna', 'die', 'young', 'young', 'young', 'uh', 'grindin', 'way', 'long', 'long', 'long', 'uh', 'wanna', 'die', 'young', 'young', 'young', 'countin', 'bands', 'hallelujah', 'lujah', 'lujah', 'yuh', 'wanna', 'die', 'young', 'young', 'young', 'uh']",8,Self-Reflection
