title,tag,artist,year,views,lyrics,language,processed_lyrics,processed_LDA_lyrics,topic,theme
Leave,rock,post malone,2016,387302,"[Intro]
Oh-oh-oh-oh

[Verse 1]
She said, ""Love me"" so I love her (Oh-oh-oh-oh)
She said, ""Leave me"" so I left (Oh-oh-oh-oh)
Then I went to California (Oh-oh-oh-oh)
And I ain't never comin' back
I got a high five from a brother (Oh-oh-oh-oh)
I got bloodstains on the bed (Oh-oh-oh-oh)
And I ain't sayin' that I love her (Oh-oh-oh-oh)
But this bitch is gonna drive me mad
I said this bitch is gonna drive me mad (Ah-ah-ah-ah-ah-ah, oh-oh-oh-oh)

[Chorus]
You got just what I been looking for
But you can't bring yourself to say no
And I ain't never gonna let you go
I kept wishing I would die, oh
The whole plane ride home
And I wish I could
I know I should leave you alone
(Oh-oh-oh-oh)
(Oh-oh-oh-oh)
[Verse 2]
I worship since I met you (Oh-oh-oh-oh)
I fell down to my knees (Oh-oh-oh-oh)
And when no one would accept ya (Oh-oh-oh-oh)
Throw myself up on a cross and bleed
I seen a dark cloud coming over (Oh-oh-oh-oh)
I seen some evil shit in her head (Oh-oh-oh-oh)
But she rode me like no other (Oh-oh-oh-oh)
But this bitch is gonna drive me mad
I said this bitch is gonna drive me mad (Ah-ah-ah-ah-ah-ah, oh-oh-oh-oh)

[Chorus]
You got just what I been looking for
But you can't bring yourself to say no
And I ain't never gonna let you go
I kept wishing I would die, oh
That whole plane ride home
And I wish I could
I know I should leave you alone
(Oh-oh-oh-oh)
(Oh-oh-oh-oh)
(Oh-oh-oh-oh)
(Oh-oh-oh-oh)
You got just what I been looking for
But you can't bring yourself to say no
And I ain't never gonna let you go
I kept wishing I would die, oh
That whole plane ride home
And I wish I could
I know I should leave you alone
(Oh-oh-oh-oh)
(Oh-oh-oh-oh)
(Oh-oh-oh-oh)
(Oh-oh-oh-oh)",en,"oh-oh-oh-oh  she said , ""love me"" so i love her  she said , ""leave me"" so i left  then i went to california  and i ain't never comin' back i got a high five from a brother  i got bloodstains on the bed  and i ain't sayin' that i love her  but this bitch is gonna drive me mad i said this bitch is gonna drive me mad   you got just what i been looking for but you can't bring yourself to say no and i ain't never gonna let you go i kept wishing i would die , oh the whole plane ride home and i wish i could i know i should leave you alone    i worship since i met you  i fell down to my knees  and when no one would accept ya  throw myself up on a cross and bleed i seen a dark cloud coming over  i seen some evil shit in her head  but she rode me like no other  but this bitch is gonna drive me mad i said this bitch is gonna drive me mad   you got just what i been looking for but you can't bring yourself to say no and i ain't never gonna let you go i kept wishing i would die , oh that whole plane ride home and i wish i could i know i should leave you alone     you got just what i been looking for but you can't bring yourself to say no and i ain't never gonna let you go i kept wishing i would die , oh that whole plane ride home and i wish i could i know i should leave you alone","['oh', 'oh', 'oh', 'oh', 'said', 'love', 'love', 'said', 'leave', 'left', 'went', 'california', 'ai', 'comin', 'got', 'high', 'brother', 'got', 'bloodstains', 'bed', 'ai', 'sayin', 'love', 'bitch', 'gon', 'na', 'drive', 'mad', 'said', 'bitch', 'gon', 'na', 'drive', 'mad', 'got', 'looking', 'bring', 'ai', 'gon', 'na', 'let', 'kept', 'wishing', 'die', 'oh', 'plane', 'ride', 'home', 'wish', 'know', 'leave', 'worship', 'met', 'fell', 'knees', 'accept', 'ya', 'throw', 'cross', 'bleed', 'seen', 'dark', 'cloud', 'coming', 'seen', 'evil', 'shit', 'head', 'rode', 'like', 'bitch', 'gon', 'na', 'drive', 'mad', 'said', 'bitch', 'gon', 'na', 'drive', 'mad', 'got', 'looking', 'bring', 'ai', 'gon', 'na', 'let', 'kept', 'wishing', 'die', 'oh', 'plane', 'ride', 'home', 'wish', 'know', 'leave', 'got', 'looking', 'bring', 'ai', 'gon', 'na', 'let', 'kept', 'wishing', 'die', 'oh', 'plane', 'ride', 'home', 'wish', 'know', 'leave']",6,Emotional Depths
Yours Truly Austin Post,rap,post malone,2016,223319,"[Intro]
I'ma take a Bud Light break, one minute
Ah, ah

[Chorus]
I just came down from the high of my life
I just, I just came down from the high of my life
See us poppin' champagne, we could do it all night
And if everything gone bad, we gon' make it alright (Alright)

[Verse 1]
How you expectin' them O's when you ain't put in work?
And I just got off the phone, yeah, with my realtor
And I've been eatin' so good that, bitch, my belly broke
And I might cop that Mulsanne 'cause, bitch, that Bentley talk
Put that sauce on that bitch real quick (Real quick)
Put that ice on that wrist real slick (Real slick)
Girl, I know you know my wallet's real thick (Real thick)
And I'm wonderin', wonderin' what you're drinkin' (Oh-oh)

[Chorus]
I just came down from the high of my life
I just, I just came down from the high of my life
See us poppin' champagne, we could do it all night
And if everything gone bad, we gon' make it alright
[Post-Chorus]
We don't fuckin' fuck with y'all, do we? (Do we?)
We don't gotta stunt on y'all, do we? (Do we?)
Bring that money back to yours truly (Truly)
When I'm rockin' all my goddamn jewelry (Jewelry), yeah

[Verse 2]
Hey, I just hopped out the foreign, lookin' so pretty, yeah
And yeah, that watch on my arm look like a trillion
You know that White Iverson, no, keep that jewelry tucked (Tucked)
And I just balled out my brain, I feel like Bubba Chuck (Chuck)
Girl, I'm zoned out, I feel my Xans
Ain't nobody understand
It's you and I, go and call your friends
Let's get a light like kerosene
You gon' ride that bump-and-grind
Yeah, let me see that double-time
You ain't gotta tell them hoes because they know, yeah

[Chorus]
I just came down from the high of my life
I just, I just came down from the high of my life
See us poppin' champagne, we could do it all night
And if everything gone bad, we gon' make it alright

[Post-Chorus]
We don't fuckin' fuck with y'all, do we? (Do we?)
We don't gotta stunt on y'all, do we? (Do we?)
Bring that money back to yours truly (Truly)
When I'm rockin' all my goddamn jewelry (Jewelry), yeah
[Bridge]
Tell me, who do you call (Who do you call)
When the night gets long (When the night gets long)
And you're sittin' by the phone (Sittin' by the phone)
'Cause all those drugs wore off, woah-woah

[Chorus]
I just came down from the high of my life
I just, I just came down from the high of my life
See us poppin' champagne, we could do it all night
And if everything gone bad, we gon' make it alright

[Outro]
High of my life
High of my life
High of my life
High of my life
Ooh, ooh, ooh, ooh
Ooh, ooh, ooh
High of my life",en,"i'ma take a bud light break , one minute ah , ah  i just came down from the high of my life i just , i just came down from the high of my life see us poppin' champagne , we could do it all night and if everything gone bad , we gon' make it alright   how you expectin' them o's when you ain't put in work ? and i just got off the phone , yeah , with my realtor and i've been eatin' so good that , bitch , my belly broke and i might cop that mulsanne 'cause , bitch , that bentley talk put that sauce on that bitch real quick  put that ice on that wrist real slick  girl , i know you know my wallet's real thick  and i'm wonderin' , wonderin' what you're drinkin'   i just came down from the high of my life i just , i just came down from the high of my life see us poppin' champagne , we could do it all night and if everything gone bad , we gon' make it alright  we don't fuckin' fuck with y'all , do we ?  we don't gotta stunt on y'all , do we ?  bring that money back to yours truly  when i'm rockin' all my goddamn jewelry  , yeah  hey , i just hopped out the foreign , lookin' so pretty , yeah and yeah , that watch on my arm look like a trillion you know that white iverson , no , keep that jewelry tucked  and i just balled out my brain , i feel like bubba chuck  girl , i'm zoned out , i feel my xans ain't nobody understand it's you and i , go and call your friends let's get a light like kerosene you gon' ride that bump-and-grind yeah , let me see that double-time you ain't gotta tell them hoes because they know , yeah  i just came down from the high of my life i just , i just came down from the high of my life see us poppin' champagne , we could do it all night and if everything gone bad , we gon' make it alright  we don't fuckin' fuck with y'all , do we ?  we don't gotta stunt on y'all , do we ?  bring that money back to yours truly  when i'm rockin' all my goddamn jewelry  , yeah  tell me , who do you call  when the night gets long  and you're sittin' by the phone  'cause all those drugs wore off , woah-woah  i just came down from the high of my life i just , i just came down from the high of my life see us poppin' champagne , we could do it all night and if everything gone bad , we gon' make it alright  high of my life high of my life high of my life high of my life ooh , ooh , ooh , ooh ooh , ooh , ooh high of my life","['bud', 'light', 'break', 'minute', 'ah', 'ah', 'came', 'high', 'life', 'came', 'high', 'life', 'poppin', 'champagne', 'night', 'gone', 'bad', 'gon', 'alright', 'expectin', 'o', 'ai', 'work', 'got', 'phone', 'yeah', 'realtor', 'eatin', 'good', 'bitch', 'belly', 'broke', 'cop', 'mulsanne', 'bitch', 'bentley', 'talk', 'sauce', 'bitch', 'real', 'quick', 'ice', 'wrist', 'real', 'slick', 'girl', 'know', 'know', 'wallet', 'real', 'thick', 'wonderin', 'wonderin', 'drinkin', 'came', 'high', 'life', 'came', 'high', 'life', 'poppin', 'champagne', 'night', 'gone', 'bad', 'gon', 'alright', 'fuckin', 'fuck', 'got', 'ta', 'stunt', 'bring', 'money', 'truly', 'rockin', 'goddamn', 'jewelry', 'yeah', 'hey', 'hopped', 'foreign', 'lookin', 'pretty', 'yeah', 'yeah', 'watch', 'arm', 'look', 'like', 'trillion', 'know', 'white', 'iverson', 'jewelry', 'tucked', 'balled', 'brain', 'feel', 'like', 'bubba', 'chuck', 'girl', 'zoned', 'feel', 'xans', 'ai', 'understand', 'friends', 'let', 'light', 'like', 'kerosene', 'gon', 'ride', 'bump', 'grind', 'yeah', 'let', 'double', 'time', 'ai', 'got', 'ta', 'tell', 'hoes', 'know', 'yeah', 'came', 'high', 'life', 'came', 'high', 'life', 'poppin', 'champagne', 'night', 'gone', 'bad', 'gon', 'alright', 'fuckin', 'fuck', 'got', 'ta', 'stunt', 'bring', 'money', 'truly', 'rockin', 'goddamn', 'jewelry', 'yeah', 'tell', 'night', 'gets', 'long', 'sittin', 'phone', 'drugs', 'wore', 'woah', 'woah', 'came', 'high', 'life', 'came', 'high', 'life', 'poppin', 'champagne', 'night', 'gone', 'bad', 'gon', 'alright', 'high', 'life', 'high', 'life', 'high', 'life', 'high', 'life', 'ooh', 'ooh', 'ooh', 'ooh', 'ooh', 'ooh', 'ooh', 'high', 'life']",2,Emotional Depths
Hit This Hard,rap,post malone,2016,155679,"[Intro]
(Ooh, ooh)
(Ooh, yeah, yeah)
(Ooh, yeah, yeah)
I never thought that it would hit this hard
(Ooh, yeah, yeah)
(Ooh, yeah, yeah)
I never thought that it would hit this hard

[Verse 1]
Don't do that, I tell you so
Don't overdose, like no, no, no
Oh my God, what have you become?
The traces of you, no, I can't see them
What have you become? What have you turned to?
What have you taken? Like someone hurt you
You drink that mixture, that shit gon' hit you
No, I can't fix you, no, no

[Pre-Chorus]
Ooh, yeah
I ran through, yeah
I feel a change in the air tonight (Tonight)
I saw myself in a different light (Different light)
(Ooh, yeah, yeah)
(Ooh, yeah, yeah)
I never thought that it would hit this hard
(Ooh, yeah, yeah)
(Ooh, yeah, yeah)
I never thought that it would hit this hard
[Chorus]
I just keep running and running and running around
I never thought that it would hit this hard
The feeling is different instead when you wake on the ground
I never thought that it would hit this hard
I don't know who I was in and I don't know anymore
I never thought that it would hit this hard
In the city, we sinning, we don’t ever want to come down
I never thought that it would hit this hard

[Verse 2]
Me and J take over and we way up
Now high above the city of angels
Smoke a boge in the sky, pass the fuego
I already dropped something in the Faygo
Only came to the club 'cause they paid us
Take this shit and lemme see what you made of
No sleep, little mama, we gon' stay up
Vampires on a night in Las Vegas

[Pre-Chorus]
Ooh, yeah (Ooh, yeah)
I ran through, yeah
I feel a change in the air tonight (Tonight)
I saw myself in a different light (Different light)
(Ooh, yeah, yeah)
(Ooh, yeah, yeah)
I never thought that it would hit this hard
(Ooh, yeah, yeah)
(Ooh, yeah, yeah)
I never thought that it would hit this hard
[Chorus]
I just keep running and running and running around
I never thought that it would hit this hard
The feeling is different instead when you wake on the ground
I never thought that it would hit this hard
I don't know who I was in and I don't know anymore
I never thought that it would hit this hard
In the city, we sinning, we don’t ever want to come down
I never thought that it would hit this hard
I just keep running and running and running around
I never thought that it would hit this hard
The feeling is different instead when you wake on the ground
I never thought that it would hit this hard
I don't know who I was in and I don't know anymore
I never thought that it would hit this hard
In the city, we sinning, we don’t ever want to come down
I never thought that it would hit this hard",en,"i never thought that it would hit this hard   i never thought that it would hit this hard  don't do that , i tell you so don't overdose , like no , no , no oh my god , what have you become ? the traces of you , no , i can't see them what have you become ? what have you turned to ? what have you taken ? like someone hurt you you drink that mixture , that shit gon' hit you no , i can't fix you , no , no  ooh , yeah i ran through , yeah i feel a change in the air tonight  i saw myself in a different light    i never thought that it would hit this hard   i never thought that it would hit this hard  i just keep running and running and running around i never thought that it would hit this hard the feeling is different instead when you wake on the ground i never thought that it would hit this hard i don't know who i was in and i don't know anymore i never thought that it would hit this hard in the city , we sinning , we don’t ever want to come down i never thought that it would hit this hard  me and j take over and we way up now high above the city of angels smoke a boge in the sky , pass the fuego i already dropped something in the faygo only came to the club 'cause they paid us take this shit and lemme see what you made of no sleep , little mama , we gon' stay up vampires on a night in las vegas  ooh , yeah  i ran through , yeah i feel a change in the air tonight  i saw myself in a different light    i never thought that it would hit this hard   i never thought that it would hit this hard  i just keep running and running and running around i never thought that it would hit this hard the feeling is different instead when you wake on the ground i never thought that it would hit this hard i don't know who i was in and i don't know anymore i never thought that it would hit this hard in the city , we sinning , we don’t ever want to come down i never thought that it would hit this hard i just keep running and running and running around i never thought that it would hit this hard the feeling is different instead when you wake on the ground i never thought that it would hit this hard i don't know who i was in and i don't know anymore i never thought that it would hit this hard in the city , we sinning , we don’t ever want to come down i never thought that it would hit this hard","['thought', 'hit', 'hard', 'thought', 'hit', 'hard', 'tell', 'overdose', 'like', 'oh', 'god', 'traces', 'turned', 'taken', 'like', 'hurt', 'drink', 'mixture', 'shit', 'gon', 'hit', 'fix', 'ooh', 'yeah', 'ran', 'yeah', 'feel', 'change', 'air', 'tonight', 'saw', 'different', 'light', 'thought', 'hit', 'hard', 'thought', 'hit', 'hard', 'running', 'running', 'running', 'thought', 'hit', 'hard', 'feeling', 'different', 'instead', 'wake', 'ground', 'thought', 'hit', 'hard', 'know', 'know', 'anymore', 'thought', 'hit', 'hard', 'city', 'sinning', 'want', 'come', 'thought', 'hit', 'hard', 'j', 'way', 'high', 'city', 'angels', 'smoke', 'boge', 'sky', 'pass', 'fuego', 'dropped', 'faygo', 'came', 'club', 'paid', 'shit', 'lemme', 'sleep', 'little', 'mama', 'gon', 'stay', 'vampires', 'night', 'las', 'vegas', 'ooh', 'yeah', 'ran', 'yeah', 'feel', 'change', 'air', 'tonight', 'saw', 'different', 'light', 'thought', 'hit', 'hard', 'thought', 'hit', 'hard', 'running', 'running', 'running', 'thought', 'hit', 'hard', 'feeling', 'different', 'instead', 'wake', 'ground', 'thought', 'hit', 'hard', 'know', 'know', 'anymore', 'thought', 'hit', 'hard', 'city', 'sinning', 'want', 'come', 'thought', 'hit', 'hard', 'running', 'running', 'running', 'thought', 'hit', 'hard', 'feeling', 'different', 'instead', 'wake', 'ground', 'thought', 'hit', 'hard', 'know', 'know', 'anymore', 'thought', 'hit', 'hard', 'city', 'sinning', 'want', 'come', 'thought', 'hit', 'hard']",1,Fame & Lifestyle
Broken Whiskey Glass,rap,post malone,2016,280703,"[Verse 1]
I done drank codeine from a broken whiskey glass
I done popped my pills and I smoked my share of grass
Slaved for the man and I broke my fuckin' back
So you can take your nine-to-five and shove it up your ass
And that 101 is like the highway in hell
Going too damn fast, I spilled drink on my Chanel
And I woke up and my room's fuckin' trashed like a damn hotel
And where I'm goin' next, man, only time will tell

[Refrain]
Woah-oh
Woah-oh
Woah-oh
Woah-oh

[Verse 2]
I done spent some time chasin' women that don't give a shit
I done learned my lessons and I ain't never gon' forget
Started callin' this shit, started ballin' and shit, started flickin' that wrist
They ain't never listened, now I'm makin' them hits, so I'm fuckin' your bitch (Ooh)
No, it ain't that difficult for me to forget that you ever exist
Bet you remember my name when I pull up in that whip that doesn't exist (Skrrt)
Spill lean on Supreme last Saturday
Let that shit splash, motherfucker, talk saucy
Pass me them drugs, motherfucker, let me try 'em
At the White House, call my homie Joe Biden, he flyin' out weed
Smokin' my dope, Bathing Ape, that be the clothes
Man, don't be silly, that shit you rockin' is old
Like it's years since you been to the store
Feel like Meek Milly, but I ain't from Philly
I'm poppin' a wheelie, I show off my grilly
I do this for realy and for my family
Same shit every night, man, it's all so famil'-y
The bitches, they killin' me
Like, bitch, are you kiddin' me?
Ballin', that shit Jason Kidd to me
You can't get rid of me
Yeah, you want my chain and my chi
Bitch, I'm real good at chemistry
[Refrain]
Woah-oh
Woah-oh
Woah-oh
Woah-oh",en,"i done drank codeine from a broken whiskey glass i done popped my pills and i smoked my share of grass slaved for the man and i broke my fuckin' back so you can take your nine-to-five and shove it up your ass and that 101 is like the highway in hell going too damn fast , i spilled drink on my chanel and i woke up and my room's fuckin' trashed like a damn hotel and where i'm goin' next , man , only time will tell  woah-oh woah-oh woah-oh woah-oh  i done spent some time chasin' women that don't give a shit i done learned my lessons and i ain't never gon' forget started callin' this shit , started ballin' and shit , started flickin' that wrist they ain't never listened , now i'm makin' them hits , so i'm fuckin' your bitch  no , it ain't that difficult for me to forget that you ever exist bet you remember my name when i pull up in that whip that doesn't exist  spill lean on supreme last saturday let that shit splash , motherfucker , talk saucy pass me them drugs , motherfucker , let me try 'em at the white house , call my homie joe biden , he flyin' out weed smokin' my dope , bathing ape , that be the clothes man , don't be silly , that shit you rockin' is old like it's years since you been to the store feel like meek milly , but i ain't from philly i'm poppin' a wheelie , i show off my grilly i do this for realy and for my family same shit every night , man , it's all so famil'-y the bitches , they killin' me like , bitch , are you kiddin' me ? ballin' , that shit jason kidd to me you can't get rid of me yeah , you want my chain and my chi bitch , i'm real good at chemistry  woah-oh woah-oh woah-oh woah-oh","['drank', 'codeine', 'broken', 'whiskey', 'glass', 'popped', 'pills', 'smoked', 'share', 'grass', 'slaved', 'man', 'broke', 'fuckin', 'shove', 'ass', 'like', 'highway', 'hell', 'going', 'damn', 'fast', 'spilled', 'drink', 'chanel', 'woke', 'room', 'fuckin', 'trashed', 'like', 'damn', 'hotel', 'man', 'time', 'tell', 'woah', 'oh', 'woah', 'oh', 'woah', 'oh', 'woah', 'oh', 'spent', 'time', 'chasin', 'women', 'shit', 'learned', 'lessons', 'ai', 'gon', 'forget', 'started', 'callin', 'shit', 'started', 'ballin', 'shit', 'started', 'flickin', 'wrist', 'ai', 'listened', 'makin', 'hits', 'fuckin', 'bitch', 'ai', 'difficult', 'forget', 'exist', 'bet', 'remember', 'pull', 'whip', 'exist', 'spill', 'lean', 'supreme', 'saturday', 'let', 'shit', 'splash', 'motherfucker', 'talk', 'saucy', 'pass', 'drugs', 'motherfucker', 'let', 'try', 'white', 'house', 'homie', 'joe', 'biden', 'flyin', 'weed', 'smokin', 'dope', 'bathing', 'ape', 'clothes', 'man', 'silly', 'shit', 'rockin', 'old', 'like', 'years', 'store', 'feel', 'like', 'meek', 'milly', 'ai', 'philly', 'poppin', 'wheelie', 'grilly', 'realy', 'family', 'shit', 'night', 'man', 'bitches', 'killin', 'like', 'bitch', 'kiddin', 'ballin', 'shit', 'jason', 'kidd', 'rid', 'yeah', 'want', 'chain', 'chi', 'bitch', 'real', 'good', 'chemistry', 'woah', 'oh', 'woah', 'oh', 'woah', 'oh', 'woah', 'oh']",8,Self-Reflection
